{
  "schema_version": "1.0",
  "task": "prompt-cache-stats-api",
  "head_before": "5b2c1371b80294a79a26330c222559165aaa5a99",
  "head_after": "5b2c1371b80294a79a26330c222559165aaa5a99",
  "timestamp": "2026-06-23T16:00:00+08:00",
  "files_changed": [
    {
      "path": "src/crates/execution/agent-runtime/src/prompt_cache.rs",
      "change_type": "modify",
      "lines_added": 95,
      "lines_removed": 0,
      "description": "Add hit-rate computation API to PromptCacheStats (system_prompt_total, user_context_total, system_prompt_hit_rate, user_context_hit_rate) and clear_stats() method to SessionPromptCacheStore. Derive PartialEq on PromptCacheStats for testability."
    }
  ],
  "tests_added": [
    "hit_rate_is_zero_when_no_lookups",
    "hit_rate_reflects_hits_over_total_lookups",
    "clear_stats_resets_all_counters_to_zero"
  ],
  "tests_modified": [],
  "boundary_check": {
    "no_touch_violations": [],
    "can_modify_compliance": true
  },
  "notes": [
    "Hit rate is computed as hits / (hits + misses + expired). Expired lookups count toward the denominator but not the numerator, so a high expiration rate depresses the hit rate (intentional: gives a single-number signal for cache effectiveness).",
    "Hit rate returns 0.0 when total lookups is zero instead of NaN, so callers can render it directly without special-casing the empty case.",
    "clear_stats() resets the shared Arc<Mutex<PromptCacheStats>> in place. Existing clones of the store (e.g. dispatched to worker threads) observe the reset on their next get_stats() call because they all share the same Arc.",
    "Added PartialEq to PromptCacheStats so tests can assert 'all counters reset' with assert_eq! against PromptCacheStats::default(). The struct holds only u64 fields so the derive is safe and cheap."
  ],
  "confidence": "high",
  "uncertainties": []
}
